new_price,old_price,discount,sold,vn_name,en_name,url_thumbnail
206.000 ₫,275.000 ₫,25%,189,Sữa Tắm Nước Hoa Tesori d'Oriente Hương Hoa Sen 500ml,Shower Cream #Lotus Flower And Shea Butter,https://media.hcdn.vn/catalog/product/f/a/facebook-dynamic-sua-tam-nuoc-hoa-tesori-d-oriente-huong-hoa-sen-500ml-1709092708_img_380x380_64adc6_fit_center.png
218.000 ₫,275.000 ₫,21%,65,Sữa Tắm Nước Hoa Tesori d'Oriente Hương Thanh Long 500ml,Shower Cream #Fiore Del Dragone,https://media.hcdn.vn/catalog/product/f/a/facebook-dynamic-sua-tam-nuoc-hoa-tesori-d-oriente-huong-thanh-long-500ml-1709089373_img_380x380_64adc6_fit_center.png
228.000 ₫,279.000 ₫,18%,39,Kem Dưỡng Thể Tesori d'Oriente Hương Hoa Sen 300g,Body Cream #Lotus Flower And Acacia's Milk,https://media.hcdn.vn/catalog/product/f/a/facebook-dynamic-kem-duong-the-tesori-d-oriente-huong-hoa-sen-300g-1720494336_img_380x380_64adc6_fit_center.jpg
137.000 ₫,175.000 ₫,22%,39,Sữa Tắm Nước Hoa Tesori d'Oriente Hương Hoa Sen 250ml,Shower Cream #Lotus Flower And Shea Butter,https://media.hcdn.vn/catalog/product/f/a/facebook-dynamic-sua-tam-nuoc-hoa-tesori-d-oriente-huong-hoa-sen-250ml-1720494104_img_380x380_64adc6_fit_center.jpg
205.000 ₫,275.000 ₫,25%,20,Sữa Tắm Nước Hoa Tesori d'Oriente Hy Lạp Cổ Đại 500ml,Shower Cream #Black Rose And Labdanum,https://media.hcdn.vn/catalog/product/f/a/facebook-dynamic-sua-tam-nuoc-hoa-tesori-d-oriente-hy-lap-co-dai-500ml-1709092582_img_380x380_64adc6_fit_center.png
137.000 ₫,175.000 ₫,22%,16,Sữa Tắm Nước Hoa Tesori d'Oriente Hương Thanh Long 250ml,Shower Cream #Fiore Del Dragone,https://media.hcdn.vn/catalog/product/f/a/facebook-dynamic-sua-tam-nuoc-hoa-tesori-d-oriente-huong-thanh-long-250ml-1720494550_img_380x380_64adc6_fit_center.jpg
148.000 ₫,175.000 ₫,15%,8,Sữa Tắm Nước Hoa Tesori d'Oriente Hy Lạp Cổ Đại 250ml,Shower Cream #Black Rose And Labdanum,https://media.hcdn.vn/catalog/product/f/a/facebook-dynamic-sua-tam-nuoc-hoa-tesori-d-oriente-hy-lap-co-dai-250ml-1720494736_img_380x380_64adc6_fit_center.jpg
15.000 ₫,,,12,[Mini] 1 Gói Sữa Tắm Nước Hoa Tesori d'Oriente 7ml (Mùi Ngẫu Nhiên),,https://media.hcdn.vn/catalog/product/g/o/google-shopping-gift-sample-sua-tam-nuoc-hoa-tesori-d-oriente-goi-7ml-1682309794_img_380x380_64adc6_fit_center.jpg
148.000 ₫,175.000 ₫,15%,,Sữa Tắm Nước Hoa Tesori d'Oriente Hương Ayurveda 250ml,Shower Cream #Ayurveda,https://media.hcdn.vn/catalog/product/f/a/facebook-dynamic-sua-tam-nuoc-hoa-tesori-d-oriente-huong-ayurveda-250ml-1709089864_img_380x380_64adc6_fit_center.png
219.000 ₫,275.000 ₫,20%,,Sữa Tắm Nước Hoa Tesori d'Oriente Hương Ayurveda 500ml,Shower Cream #Ayurveda,https://media.hcdn.vn/catalog/product/f/a/facebook-dynamic-sua-tam-nuoc-hoa-tesori-d-oriente-huong-ayurveda-500ml-1709089936_img_380x380_64adc6_fit_center.png
219.000 ₫,275.000 ₫,20%,,Sữa Tắm Nước Hoa Tesori d'Oriente Tinh Dầu Macca 500ml,Shower Cream #Vaniglia e Zenzero del Madagascar,https://media.hcdn.vn/catalog/product/f/a/facebook-dynamic-sua-tam-nuoc-hoa-tesori-d-oriente-tinh-dau-macca-500ml-1709089555_img_380x380_64adc6_fit_center.png
15.000 ₫,30.000 ₫,50%,3,Miếng Dán Ciracle Hỗ Trợ Hút Và Đẩy Mụn Đầu Đen (1 Miếng),Goodbye Blackhead,https://media.hcdn.vn/catalog/product/f/a/facebook-dynamic-mat-na-serum-ciracle-day-mun-dau-den-1-mieng-1736912749_img_380x380_64adc6_fit_center.jpg
60.000 ₫,80.000 ₫,25%,,Combo 4 Miếng Dán Ciracle Hỗ Trợ Hút Và Đẩy Mụn Đầu Đen,Goodbye Blackhead,https://media.hcdn.vn/catalog/product/f/a/facebook-dynamic-combo-4-mieng-ciracle-day-mun-dau-den-1736912455_img_380x380_64adc6_fit_center.jpg
120.000 ₫,160.000 ₫,25%,,Combo 8 Miếng Dán Ciracle Hỗ Trợ Hút Và Đẩy Mụn Đầu Đen,Goodbye Blackhead,https://media.hcdn.vn/catalog/product/f/a/facebook-dynamic-combo-8-mieng-ciracle-day-mun-dau-den-1736995596_img_380x380_64adc6_fit_center.jpg
143.000 ₫,214.500 ₫,33%,1.424,Sữa Tắm Lifebuoy Detox Matcha & Khổ Qua 800g,,https://media.hcdn.vn/catalog/product/f/a/facebook-dynamic-sua-tam-lifebuoy-detox-matcha-kho-qua-800g-1718682846_img_380x380_64adc6_fit_center.jpg
139.000 ₫,199.000 ₫,30%,1.358,Smoothie Tẩy Da Chết Dove Hương Lựu Đỏ 298g,Moisturizing Body Scrub Pomegranate Fragrance,https://media.hcdn.vn/catalog/product/p/r/promotions-auto-smoothie-tay-da-chet-dove-huong-luu-do-298g_mwe1jkQYcBmDVrzK_img_380x380_64adc6_fit_center.png
95.000 ₫,132.000 ₫,28%,1.611,Sữa Rửa Mặt Simple Giúp Da Sạch Thoáng 150ml,Kind To Skin Refreshing Facial Wash Gel,https://media.hcdn.vn/catalog/product/p/r/promotions-auto-gel-rua-mat-danh-cho-da-nhay-cam-simple-150ml_24eoXozFDukWYZTr_img_380x380_64adc6_fit_center.png
227.000 ₫,300.000 ₫,24%,514,Combo Sữa Dưỡng Thể Vaseline Sáng Mịn Da Ngày & Đêm 330mlx2,Gluta-Hya Serum Burst UV Lotion Flawless Bright & Dewy Radiance,https://media.hcdn.vn/catalog/product/f/a/facebook-dynamic-422211153-1689238041_img_380x380_64adc6_fit_center.jpg
112.000 ₫,150.000 ₫,25%,990,Sữa Dưỡng Thể Vaseline Sáng Da Chuyên Sâu Ban Đêm 330ml,Gluta-Hya Serum Burst UV Lotion Dewy Radiance,https://media.hcdn.vn/catalog/product/p/r/promotions-auto-serum-vaseline-gluta-hya-sang-da-chuyen-sau-ban-dem-330ml_8aVEHBzsg2sryjDj_img_380x380_64adc6_fit_center.png
109.000 ₫,180.000 ₫,39%,948,Nước Hoa Hồng Simple Làm Dịu Da & Cấp Ẩm 200ml,Kind to Skin Soothing Facial Toner,https://media.hcdn.vn/catalog/product/p/r/promotions-auto-nuoc-hoa-hong-simple-danh-cho-da-nhay-cam-200ml_1BkMZjrfHvtkHYYS_img_380x380_64adc6_fit_center.png
303.000 ₫,370.000 ₫,18%,293,Bộ Gội Xả TRESemmé Keratin Vào Nếp Suôn Mượt 640g+620g,Keratin Smooth Shampoo & Conditioner,https://media.hcdn.vn/catalog/product/p/r/promotions-auto-combo-tresemme-keratin-smooth-vao-nep-muot-ma-dau-goi-640g-dau-xa-620g_rfohrSXsCtjqoDzF_img_380x380_64adc6_fit_center.png
95.000 ₫,132.000 ₫,28%,875,"Gel Rửa Mặt Simple Thanh Khiết, Giảm Bóng Nhờn 150ml",Purifying Gel Wash,https://media.hcdn.vn/catalog/product/p/r/promotions-auto-sua-rua-mat-simple-kiem-dau-ngua-mun-cho-da-mun-150ml_2iwHVtrRtzaCpzyW_img_380x380_64adc6_fit_center.png
136.000 ₫,203.000 ₫,33%,549,Serum Dưỡng Thể Vaseline Chống Nắng Sáng Da 300ml (Mới),Healthy Bright Daily Protection & Brightening Serum SPF 50+ PA++++,https://media.hcdn.vn/catalog/product/p/r/promotions-auto-serum-chong-nang-co-the-vaseline-duong-sang-da-300ml-moi_q2Fo4fog5GcZcoCC_img_380x380_64adc6_fit_center.png
145.000 ₫,198.000 ₫,27%,512,Nước Tẩy Trang Simple Làm Sạch Trang Điểm Vượt Trội 400ml,Kind To Skin Micellar Cleansing Water,https://media.hcdn.vn/catalog/product/p/r/promotions-auto-nuoc-tay-trang-simple-lam-sach-trang-diem-va-cap-am-400ml_ASVstGNujUHqxMZv_img_380x380_64adc6_fit_center.png
150.000 ₫,234.000 ₫,36%,472,Sữa Tắm Lifebuoy Detox Than Hoạt Tính & Cám Gạo 800g,,https://media.hcdn.vn/catalog/product/f/a/facebook-dynamic-sua-tam-lifebuoy-detox-than-hoat-tinh-cam-gao-800g-1718681642_img_380x380_64adc6_fit_center.jpg
223.000 ₫,589.000 ₫,62%,302,Combo Simple Chăm Sóc Cho Da Sạch Khỏe Đàn Hồi 3 Món,Micellar Cleansing Water 200ml + Refreshing Facial Wash Gel 150ml + Soothing Facial Toner 200ml,https://media.hcdn.vn/catalog/product/f/a/facebook-dynamic-422203645-1733714490_img_380x380_64adc6_fit_center.jpg
136.000 ₫,199.000 ₫,32%,495,Smoothie Tẩy Da Chết Dove Hương Hoa Anh Đào 298g,Moisturizing Body Scrub Sakura Fragrance,https://media.hcdn.vn/catalog/product/p/r/promotions-auto-smoothie-tay-da-chet-dove-huong-hoa-anh-dao-298g_ophCG831SZbpTak6_img_380x380_64adc6_fit_center.png
133.000 ₫,195.000 ₫,32%,498,Sữa Dưỡng Thể Vaseline Gluta-Hya Nâng Tông Tức Thì 300ml,Healthy Bright Gluta-Hya Body Tone-Up UV Lotion,https://media.hcdn.vn/catalog/product/p/r/promotions-auto-sua-duong-the-vaseline-gluta-hya-nang-tong-tuc-thi-300ml_mk5mZxNmPzgom8s1_img_380x380_64adc6_fit_center.png
726.000 ₫,1.300.000 ₫,44%,90,Bàn Chải Điện P/S S100 Pro Sạch Mảng Bám Tới 10X Màu Xanh,S100 Pro Expertcare,https://media.hcdn.vn/catalog/product/p/r/promotions-auto-ban-chai-dien-p-s-s100-pro-cong-nghe-song-am-mau-xanh-ombre_cNLuTjZCmhfDw6yK_img_380x380_64adc6_fit_center.png
76.000 ₫,105.000 ₫,28%,840,Serum Ngăn Mùi Dove Giúp Da Sáng Mịn Đều Màu 40ml,Deodorant Dry Serum 3% Niacinamide + 10X Collagen,https://media.hcdn.vn/catalog/product/p/r/promotions-auto-kem-khu-mui-dove-collagen-b3-duong-sang-deu-mau-40ml_f5DsTn81VR3gbdTU_img_380x380_64adc6_fit_center.png
143.000 ₫,214.500 ₫,33%,401,Sữa Tắm Lifebuoy Detox Thảo Dược & Hoa Sen 800g,,https://media.hcdn.vn/catalog/product/f/a/facebook-dynamic-sua-tam-lifebuoy-detox-thao-duoc-hoa-sen-800g-1718682474_img_380x380_64adc6_fit_center.jpg
91.000 ₫,139.000 ₫,35%,585,Sữa Tắm Hazeline Sáng Mịn Dưỡng Ẩm Yến Mạch & Dâu Tằm 1kg,,https://media.hcdn.vn/catalog/product/f/a/facebook-dynamic-422208316-1689233754_img_380x380_64adc6_fit_center.jpg
158.000 ₫,234.000 ₫,32%,327,Sữa Tắm Lifebuoy Detox Muối Hồng & Rau Má 800g,,https://media.hcdn.vn/catalog/product/f/a/facebook-dynamic-sua-tam-lifebuoy-detox-dau-tram-tra-muoi-hong-800g-1720692667_img_380x380_64adc6_fit_center.jpg
200.000 ₫,264.000 ₫,24%,219,Combo 2 Sữa Rửa Mặt Simple Giúp Da Sạch Thoáng 150ml,Kind To Skin Refreshing Facial Wash Gel,https://media.hcdn.vn/catalog/product/p/r/promotions-auto-combo-2-sua-rua-mat-simple-giup-da-sach-thoang-150ml_EdfDMsTUHJtE2ypW_img_380x380_64adc6_fit_center.png
65.000 ₫,82.000 ₫,21%,609,Sáp Dưỡng Môi Vaseline Hồng Xinh 7g,Lip Therapy Rosy Lips,https://media.hcdn.vn/catalog/product/f/a/facebook-dynamic-sap-duong-moi-hong-xinh-vaseline-7g-1726631121_img_380x380_64adc6_fit_center.jpg
148.000 ₫,229.000 ₫,35%,261,Serum Dưỡng Tóc TRESemmé Vào Nếp Suôn Mượt 100ml (Mới),Keratin Smooth KeratinBond+ Serum,https://media.hcdn.vn/catalog/product/p/r/promotions-auto-serum-duong-toc-tresemme-vao-nep-suon-muot-100ml-moi_vgrNQhzSb8MH8JYx_img_380x380_64adc6_fit_center.png
278.000 ₫,398.000 ₫,30%,133,Combo 2 Smoothie Tẩy Da Chết Dove Đường Nâu & Hương Dừa 298g,Moisturizing Body Scrub Sugar & Coconut Fragrance,https://media.hcdn.vn/catalog/product/p/r/promotions-auto-combo-2-smoothie-tay-da-chet-dove-duong-nau-huong-dua-298g_P1GSP9yj8GHxWSFs_img_380x380_64adc6_fit_center.png
245.000 ₫,300.000 ₫,18%,148,Combo 2 Sữa Dưỡng Thể Vaseline Sáng Da Chuyên Sâu Ban Đêm (330ml/chai),Gluta-Hya Serum Burst UV Lotion Dewy Radiance,https://media.hcdn.vn/catalog/product/f/a/facebook-dynamic-422211152-1689240954_img_380x380_64adc6_fit_center.jpg
139.000 ₫,250.000 ₫,44%,254,Smoothie Tẩy Da Chết Dove Đường Nâu & Hương Dừa 298g,Moisturizing Body Scrub Sugar & Coconut Fragrance,https://media.hcdn.vn/catalog/product/p/r/promotions-auto-smoothie-tay-da-chet-dove-duong-nau-huong-dua-298g_Snn1ue9tAsJUwD3r_img_380x380_64adc6_fit_center.png
197.000 ₫,264.000 ₫,25%,156,"Combo 2 Gel Rửa Mặt Simple Thanh Khiết, Giảm Bóng Nhờn 150ml",Purifying Gel Wash,https://media.hcdn.vn/catalog/product/p/r/promotions-auto-combo-2-gel-rua-mat-simple-thanh-khiet-giam-bong-nhon-150ml_xfatvze4ELmbxA3V_img_380x380_64adc6_fit_center.png
188.000 ₫,226.000 ₫,17%,164,Sữa Tắm Dưỡng Thể Dove Sáng Da Rạng Rỡ  900g,Pro-Ceramide Radiance,https://media.hcdn.vn/catalog/product/p/r/promotions-auto-sua-tam-duong-the-dove-da-am-min-luu-huong-ngot-ngao-900g_hzNT4vHZbwKZtSBi_img_380x380_64adc6_fit_center.png
726.000 ₫,1.300.000 ₫,44%,40,Bàn Chải Điện P/S S100 Pro Sạch Mảng Bám Tới 10X Màu Đen,S100 Pro Expertcare,https://media.hcdn.vn/catalog/product/p/r/promotions-auto-ban-chai-dien-p-s-s100-pro-cong-nghe-song-am-mau-den_va74bCi23LBGRvTL_img_380x380_64adc6_fit_center.png
70.000 ₫,97.000 ₫,28%,405,Lăn Ngăn Mùi Dove Tinh Chất Serum Sáng Mịn Đều Màu 45ml,Deodorant Serum 3% Niacinamide + 10X Collagen,https://media.hcdn.vn/catalog/product/p/r/promotions-auto-lan-ngan-mui-dove-tinh-chat-serum-sang-min-deu-mau-45ml_TyPm5fE9Cwf1YGbU_img_380x380_64adc6_fit_center.png
82.000 ₫,210.000 ₫,61%,339,Nước Tẩy Trang Simple Làm Sạch Trang Điểm 200ml,Kind To Skin Micellar Cleansing Water,https://media.hcdn.vn/catalog/product/f/a/facebook-dynamic-211300005-1731657239_img_380x380_64adc6_fit_center.jpg
287.000 ₫,380.000 ₫,24%,96,Kem Dưỡng Da Pond's Ngăn Ngừa Lão Hoá Cho Ban Đêm 45g,Age Miracle Night Cream,https://media.hcdn.vn/catalog/product/f/a/facebook-dynamic-kem-duong-da-pond-s-ngan-ngua-lao-hoa-cho-ban-dem-50g-1713945200_img_380x380_64adc6_fit_center.jpg
72.000 ₫,105.000 ₫,31%,381,Serum Ngăn Mùi Dove Giúp Mờ Thâm Thu Nhỏ Lỗ Chân Lông 40ml,Deodorant Dry Serum 3% Niacinamide + 10X Vit C&E,https://media.hcdn.vn/catalog/product/p/r/promotions-auto-serum-ngan-mui-dove-giup-mo-tham-thu-nho-lo-chan-long-40ml_6qv4R5Jq28Kuq4tq_img_380x380_64adc6_fit_center.png
75.000 ₫,89.000 ₫,16%,355,Son Dưỡng Có Màu Vaseline Hồng Cam Êm Dịu 3g,Colour + Care #Mellow Rose,https://media.hcdn.vn/catalog/product/f/a/facebook-dynamic-son-duong-co-mau-vaseline-hong-cam-em-diu-3g-1734324877_img_380x380_64adc6_fit_center.jpg
147.000 ₫,198.000 ₫,26%,179,Dầu Gội Clear 9 Thảo Dược Chăm Sóc Da Đầu Yếu 630g,,https://media.hcdn.vn/catalog/product/f/a/facebook-dynamic-dau-goi-sach-gau-clear-thao-duoc-cham-soc-da-dau-yeu-630g-1727064943_img_380x380_64adc6_fit_center.jpg
91.000 ₫,139.000 ₫,35%,288,Sữa Tắm Hazeline Sáng Mịn Rạng Ngời Matcha & Lựu Đỏ 1kg,,https://media.hcdn.vn/catalog/product/f/a/facebook-dynamic-422208317-1689233438_img_380x380_64adc6_fit_center.jpg
109.000 ₫,157.000 ₫,31%,240,Sữa Tắm Lux Botanicals Hương Phong Lan Quyến Rũ 570g,,https://media.hcdn.vn/catalog/product/f/a/facebook-dynamic-422214293-1692937668_img_380x380_64adc6_fit_center.png
225.000 ₫,589.000 ₫,62%,115,Combo Simple Chăm Sóc Làn Da Dầu Mụn 3 Món,Kind To Skin Micellar Cleansing Water + Purifying Gel Wash + Kind to Skin Soothing Facial Toner,https://media.hcdn.vn/catalog/product/f/a/facebook-dynamic-422214577-1731902426_img_380x380_64adc6_fit_center.jpg
99.000 ₫,150.000 ₫,34%,261,Sữa Dưỡng Thể Vaseline Dịu Mát Sáng Da 350ml,Healthy Bright Fresh & Bright Cooling UV Niacinamide Lotion,https://media.hcdn.vn/catalog/product/p/r/promotions-auto-sua-duong-the-vaseline-diu-mat-sang-da-350ml_hhNDghhaqoBCi1nV_img_380x380_64adc6_fit_center.png
178.000 ₫,226.000 ₫,21%,142,"Sữa Tắm Dưỡng Thể Dove Tươi Mát, Da Sảng Khoái 900g",Pro-Ceramide Invigorating,https://media.hcdn.vn/catalog/product/p/r/promotions-auto-sua-tam-duong-the-dove-da-bong-min-luu-huong-thom-mat-900g_KMwBJWPTaSvbeDQp_img_380x380_64adc6_fit_center.png
135.000 ₫,155.000 ₫,13%,183,Kem Xả Dove Phục Hồi Hư Tổn Cho Tóc Chắc Khỏe (Mới) 610g,,https://media.hcdn.vn/catalog/product/f/a/facebook-dynamic-kem-xa-dove-phuc-hoi-hu-ton-cho-toc-chac-khoe-moi-610g-1650003974-1719903905_img_380x380_64adc6_fit_center.jpg
46.000 ₫,58.000 ₫,21%,12,"Kem Đánh Răng Perioe Total7 Trắng Răng, Hơi Thở Thơm Mát 120g",Total7 Intense Freezing Cooling Toothpaste,https://media.hcdn.vn/catalog/product/f/a/facebook-dynamic-kem-danh-rang-perioe-total7-trang-rang-hoi-tho-thom-mat-120g-1719461271_img_380x380_64adc6_fit_center.jpg
46.000 ₫,58.000 ₫,21%,4,"Kem Đánh Răng Perioe Total7 Trắng Răng, Bảo Vệ Nướu 120g",Total7 Intense Refresh Cooling Toothpaste,https://media.hcdn.vn/catalog/product/f/a/facebook-dynamic-kem-danh-rang-perioe-total7-trang-rang-bao-ve-nuou-120g-1719460588_img_380x380_64adc6_fit_center.jpg
46.000 ₫,58.000 ₫,21%,4,Kem Đánh Răng Perioe Total7 Hương Bạc Hà 120g,Total7 Intense Cleanmint Repair Toothpaste,https://media.hcdn.vn/catalog/product/f/a/facebook-dynamic-kem-danh-rang-perioe-total7-huong-bac-ha-120g-1719459732_img_380x380_64adc6_fit_center.jpg
46.000 ₫,58.000 ₫,21%,3,Kem Đánh Răng Perioe Total7 Vị Nguyên Bản 120g,Total7 Intense Original Repair Toothpaste,https://media.hcdn.vn/catalog/product/f/a/facebook-dynamic-kem-danh-rang-perioe-total7-vi-nguyen-ban-120g-1719459210_img_380x380_64adc6_fit_center.jpg
38.000 ₫,55.000 ₫,31%,,Kem Đánh Răng Perioe Ngăn Ngừa Sâu Răng 180g,Total Cavity Care,https://media.hcdn.vn/catalog/product/f/a/facebook-dynamic-422211918-1689654947_img_380x380_64adc6_fit_center.jpg
531.000 ₫,715.000 ₫,26%,1.168,Sữa Chống Nắng Anessa Dưỡng Da Kiềm Dầu 60ml (Bản Mới 2024),Perfect UV Sunscreen Skincare Milk N SPF50+ PA++++,https://media.hcdn.vn/catalog/product/p/r/promotions-auto-sua-chong-nang-anessa-duong-da-kiem-dau-60ml-moi_XKB1Gebm1b5Rkzrv_img_380x380_64adc6_fit_center.png
534.000 ₫,715.000 ₫,25%,854,Sữa Chống Nắng Anessa Cho Da Nhạy Cảm & Trẻ Em 60ml (Mới),Perfect UV Sunscreen Mild Milk (For Sensitive Skin) SPF50+/PA++++,https://media.hcdn.vn/catalog/product/p/r/promotions-auto-sua-chong-nang-anessa-cho-da-nhay-cam-tre-em-60ml-moi_FJzr11wusyMQHETs_img_380x380_64adc6_fit_center.png
429.000 ₫,575.000 ₫,25%,191,Gel Chống Nắng Anessa Dưỡng Ẩm Bảo Vệ Hoàn Hảo 90g (Mới),Perfect UV Sunscreen Skincare Gel N SPF50+/PA++++,https://media.hcdn.vn/catalog/product/p/r/promotions-auto-gel-chong-nang-anessa-duong-am-bao-ve-hoan-hao-90g-moi_YGrU14xaJyWtfmZq_img_380x380_64adc6_fit_center.png
456.000 ₫,575.000 ₫,21%,178,Gel Chống Nắng Anessa Dưỡng Sáng Nâng Tông 90g (Mới),Brightening Uv Sunscreen Gel N SPF50+ PA++++,https://media.hcdn.vn/catalog/product/p/r/promotions-auto-gel-chong-nang-anessa-duong-sang-nang-tong-90g-moi_BSXYMGEwKCYYKUhs_img_380x380_64adc6_fit_center.png
240.000 ₫,285.000 ₫,16%,241,Sữa Chống Nắng Anessa Dưỡng Da Kiềm Dầu 20ml (Mới),Perfect UV Sunscreen Skincare Milk N SPF50+ PA++++,https://media.hcdn.vn/catalog/product/p/r/promotions-auto-sua-chong-nang-anessa-duong-da-kiem-dau-20ml-moi_62L5Hp8SGfua5UWV_img_380x380_64adc6_fit_center.png
664.000 ₫,850.000 ₫,22%,52,Serum Chống Nắng Anessa Dưỡng Da Nâng Tông 30ml,Day Serum SPF50+ PA++++,https://media.hcdn.vn/catalog/product/p/r/promotions-auto-serum-chong-nang-anessa-duong-da-nang-tong-30ml_63m4zmtGCnz8aqbE_img_380x380_64adc6_fit_center.png
802.000 ₫,1.000.000 ₫,20%,41,Combo 2 Sữa Chống Nắng Anessa Dưỡng Da Kiềm Dầu 60ml+20ml (Bản Mới 2024),Perfect UV Sunscreen Skincare Milk N SPF50+ PA++++,https://media.hcdn.vn/catalog/product/p/r/promotions-auto-combo-2-sua-chong-nang-anessa-duong-da-kiem-dau-60ml-20ml-moi_DkqhSyq1BcRY9zXU_img_380x380_64adc6_fit_center.png
234.000 ₫,390.000 ₫,40%,91,Bọt Rửa Mặt d program Giúp Làm Sạch Và Cung Cấp Ẩm Da 120g,Essence In Cleansing Foam,https://media.hcdn.vn/catalog/product/f/a/facebook-dynamic-422200367-1732764379_img_380x380_64adc6_fit_center.jpg
363.000 ₫,455.000 ₫,20%,48,Xịt Chống Nắng Anessa Dưỡng Da Đa Năng 60g (Mới),Perfect UV Sunscreen Skincare Spray N SPF50+ PA++++,https://media.hcdn.vn/catalog/product/p/r/promotions-auto-xit-chong-nang-anessa-duong-da-da-nang-60g-moi_gUUwmLastynFasPE_img_380x380_64adc6_fit_center.png
487.000 ₫,750.000 ₫,35%,25,Kem Dưỡng d program Hỗ Trợ Phục Hồi Da 45g,Skin Repair Cream,https://media.hcdn.vn/catalog/product/f/a/facebook-dynamic-422208061-1732765959_img_380x380_64adc6_fit_center.jpg
471.000 ₫,550.000 ₫,14%,14,"Sữa Chống Nắng Elixir Nâng Tông, Kiềm Dầu 35g",Reflet Balancing Oshiroi Milk C SPF50+ PA++++,https://media.hcdn.vn/catalog/product/p/r/promotions-auto-sua-chong-nang-elixir-nang-tong-kiem-dau-35g_m2CqhKMB8rgMT4kJ_img_380x380_64adc6_fit_center.png
487.000 ₫,575.000 ₫,15%,13,Gel Chống Nắng Anessa Cho Da Nhạy Cảm & Trẻ Em 90g (Mới),Mineral UV Sunscreen Mild Gel (For Sensitive Skin) SPF35/PA+++,https://media.hcdn.vn/catalog/product/p/r/promotions-auto-gel-chong-nang-anessa-cho-da-nhay-cam-tre-em-90g-moi_oXooPBWXWxAUvYFf_img_380x380_64adc6_fit_center.png
792.000 ₫,990.000 ₫,20%,7,"Sữa Chống Nắng Elixir Nâng Tông, Ngừa Lão Hóa 35g",Day Care Revolution Tone-Up SPF50+ PA++++,https://media.hcdn.vn/catalog/product/p/r/promotions-auto-sua-chong-nang-elixir-nang-tong-ngua-lao-hoa-35g_KxKr3YBQd4poYNAb_img_380x380_64adc6_fit_center.png
367.000 ₫,490.000 ₫,25%,15,Dầu Tẩy Trang d program Dành Cho Da Nhạy Cảm 120ml,Essence In Cleansing Oil,https://media.hcdn.vn/catalog/product/f/a/facebook-dynamic-422200365-1732765769_img_380x380_64adc6_fit_center.jpg
1.180.000 ₫,1.390.000 ₫,15%,4,"Serum Elixir Hỗ Trợ Săn Chắc Da, Ngừa Lão Hóa 40ml",Superieur Design Time Serum,https://media.hcdn.vn/catalog/product/p/r/promotions-auto-serum-elixir-ho-tro-san-chac-da-ngua-lao-hoa-40ml_d4R6B9DC8t3yZbfX_img_380x380_64adc6_fit_center.png
472.000 ₫,690.000 ₫,32%,9,Tinh Chất Chống Nắng d program Kiềm Dầu SPF 50 PA+++ 40ml,Allerdefense Essence N,https://media.hcdn.vn/catalog/product/f/a/facebook-dynamic-422206141-1705051028_img_380x380_64adc6_fit_center.jpg
394.000 ₫,590.000 ₫,33%,11,BB Chống Nắng Trang Điểm d program Tông Sáng 30ml,Allerdefense Essence BB Light SPF50+ PA+++,https://media.hcdn.vn/catalog/product/f/a/facebook-dynamic-422206144-1705051494_img_380x380_64adc6_fit_center.jpg
1.016.000 ₫,1.430.000 ₫,29%,4,Combo 2 Sữa Chống Nắng Anessa Cho Da Nhạy Cảm & Trẻ Em 60ml (Mới),Perfect UV Sunscreen Mild Milk (For Sensitive Skin) SPF50+/PA++++,https://media.hcdn.vn/catalog/product/p/r/promotions-auto-combo-2-sua-chong-nang-anessa-cho-da-nhay-cam-tre-em-60ml-moi_2pYpxgs5J5HvJYQN_img_380x380_64adc6_fit_center.png
765.000 ₫,900.000 ₫,15%,5,Serum d program Dưỡng Sáng Da Dạng Jelly 60g,Whitening Jelly Clear Essence,https://media.hcdn.vn/catalog/product/f/a/facebook-dynamic-419200010-1705114546_img_380x380_64adc6_fit_center.jpg
471.000 ₫,550.000 ₫,14%,7,"Sữa Rửa Mặt Elixir 2 Trong 1 Dưỡng Ẩm, Ngừa Lão Hóa 140ml",Superieur Moist-In Cleanser,https://media.hcdn.vn/catalog/product/p/r/promotions-auto-sua-rua-mat-elixir-2-trong-1-duong-am-ngua-lao-hoa-140ml_pxuW6Ew7twzM384F_img_380x380_64adc6_fit_center.png
517.000 ₫,690.000 ₫,25%,6,Serum d program Dưỡng Da Bảo Vệ Chuyên Sâu 40ml,Thermo Defense Serum,https://media.hcdn.vn/catalog/product/f/a/facebook-dynamic-422202864-1705051849_img_380x380_64adc6_fit_center.jpg
544.000 ₫,890.000 ₫,39%,5,Sữa Dưỡng d program Dành Cho Da Mụn 100ml,Acne Care Emulsion,https://media.hcdn.vn/catalog/product/f/a/facebook-dynamic-419200006-1705115628_img_380x380_64adc6_fit_center.jpg
760.000 ₫,950.000 ₫,20%,3,Sữa Chống Nắng Elixir Dưỡng Da Ngừa Lão Hóa 35ml,Daily UV Protector SPF50+ PA++++,https://media.hcdn.vn/catalog/product/p/r/promotions-auto-sua-chong-nang-elixir-duong-da-ngua-lao-hoa-35ml_MKUVGTLcMgwnSKww_img_380x380_64adc6_fit_center.png
974.000 ₫,1.300.000 ₫,25%,3,Kem Dưỡng d program Ngăn Ngừa Lão Hóa 45g,Vitalizing Cream,https://media.hcdn.vn/catalog/product/f/a/facebook-dynamic-422214012-1705048559_img_380x380_64adc6_fit_center.png
200.000 ₫,,,10,"[Mini] Serum Elixir Hỗ Trợ Săn Chắc Da, Ngừa Lão Hóa 18ml",Superieur Design Time Serum,https://media.hcdn.vn/catalog/product/f/a/facebook-dynamic-gift-serum-18ml-ho-tro-san-chac-da-ngua-lao-hoa-elixir-1718091878_img_380x380_64adc6_fit_center.jpg
951.000 ₫,1.150.000 ₫,17%,3,Combo 2 Gel Chống Nắng Anessa Dưỡng Sáng Nâng Tông 90g (Mới),Brightening Uv Sunscreen Gel N SPF50+ PA++++,https://media.hcdn.vn/catalog/product/p/r/promotions-auto-combo-2-gel-chong-nang-anessa-duong-sang-nang-tong-90g-moi_3KJgZYH19X5yasCD_img_380x380_64adc6_fit_center.png
1.592.000 ₫,1.990.000 ₫,20%,1,Kem Dưỡng Elixir Retinol Hỗ Trợ Giảm Nếp Nhăn 15g,Retinol Power Wrinkle Smoothing Cream,https://media.hcdn.vn/catalog/product/p/r/promotions-auto-kem-duong-elixir-retinol-ho-tro-giam-nep-nhan-15g_DcjNeo5bpzPBX5at_img_380x380_64adc6_fit_center.png
775.000 ₫,990.000 ₫,22%,2,"Sữa Chống Nắng Elixir Hỗ Trợ Dưỡng Sáng, Ngừa Lão Hóa 35ml",Daily Brightening UV Protector SPF50+ PA++++,https://media.hcdn.vn/catalog/product/p/r/promotions-auto-sua-chong-nang-elixir-ho-tro-duong-sang-ngua-lao-hoa-35ml_KQVsvJsvKpfzZiYf_img_380x380_64adc6_fit_center.png
751.000 ₫,1.000.000 ₫,25%,2,Sữa Dưỡng d program Dưỡng Sáng & Làm Dịu Da 100ml,Whitening Clear Emulsion,https://media.hcdn.vn/catalog/product/f/a/facebook-dynamic-419200009-1705114701_img_380x380_64adc6_fit_center.jpg
394.000 ₫,590.000 ₫,33%,4,BB Chống Nắng Trang Điểm d program Tông Tự Nhiên 30ml,Allerdefense Essence BB Medium SPF50+ PA+++,https://media.hcdn.vn/catalog/product/f/a/facebook-dynamic-422206143-1705051571_img_380x380_64adc6_fit_center.jpg
593.000 ₫,790.000 ₫,25%,2,Nước Cân Bằng d program Dưỡng Sáng Da 125ml,Whitening Clear Lotion,https://media.hcdn.vn/catalog/product/f/a/facebook-dynamic-419200008-1705114975_img_380x380_64adc6_fit_center.jpg
367.000 ₫,490.000 ₫,25%,3,Nước Tẩy Trang d program Dành Cho Da Nhạy Cảm 180ml,Essence In Cleansing Water,https://media.hcdn.vn/catalog/product/f/a/facebook-dynamic-422200366-1705055245_img_380x380_64adc6_fit_center.jpg
935.000 ₫,1.100.000 ₫,15%,1,Sữa Dưỡng d program Cải Thiện Các Dấu Hiệu Lão Hóa 100ml,Vital Act Emulsion,https://media.hcdn.vn/catalog/product/f/a/facebook-dynamic-419200003-1705116707_img_380x380_64adc6_fit_center.jpg
